{
  "schema_version": "unified_market_evidence_preview_response.v1",
  "request_id": "req-1234",
  "status": "ready_for_confirmation",
  "target_resolution_summary": {
    "resolved": ["2330"],
    "ambiguous": [],
    "not_found": []
  },
  "requested_data_needs": [
    "recent_performance",
    "current_observation"
  ],
  "planned_evidence": [
    "recent_performance",
    "current_observation"
  ],
  "coverage_expectation": {
    "status": "full_possible",
    "known_gaps": []
  },
  "bounds": {
    "target_count": 1,
    "operation_count": 2,
    "estimated_network_calls": 2,
    "expanded_scope": false
  },
  "fallbacks": [],
  "approval": {
    "required": true,
    "confirmation_text": "Proceed with 2 operations?"
  },
  "internal_execution_reference": {
    "preview_id": "prev-5678"
  },
  "caveats": []
}
